{
  "id": "rule-recall-data-protection",
  "title": "Воспроизведение нормы (rule-recall) — data-protection",
  "reasoning_type": "rule-recall",
  "domain": "data-protection",
  "answer_type": "extraction",
  "scoring": "normalized_match",
  "description": "Сгенерировано + адверсариально верифицировано (3 линзы). Домен data-protection.",
  "gold_source": "lawyer-authored skills репо + верификация норм",
  "needs_expert_review": true,
  "license": "CC-BY-4.0",
  "version": "0.2.0"
}
