{
  "id": "citation-data-protection",
  "title": "Точная ссылка на норму (citation) — data-protection",
  "reasoning_type": "citation",
  "domain": "data-protection",
  "answer_type": "norm_citation",
  "scoring": "norm_f1",
  "description": "Сгенерировано + адверсариально верифицировано (3 линзы). Домен data-protection.",
  "gold_source": "lawyer-authored skills репо + верификация норм",
  "needs_expert_review": true,
  "license": "CC-BY-4.0",
  "version": "0.2.0"
}
