{
  "id": "rule-conclusion-labor",
  "title": "Вывод Да/Нет (rule-conclusion) — labor",
  "reasoning_type": "rule-conclusion",
  "domain": "labor",
  "answer_type": "binary",
  "scoring": "binary_accuracy",
  "description": "Сгенерировано + адверсариально верифицировано (3 линзы). Домен labor.",
  "gold_source": "lawyer-authored skills репо + верификация норм",
  "needs_expert_review": true,
  "license": "CC-BY-4.0",
  "version": "0.2.0"
}
