{
  "id": "rule-application-litigation",
  "title": "Применение нормы к фактам (rule-application) — litigation",
  "reasoning_type": "rule-application",
  "domain": "litigation",
  "answer_type": "extraction",
  "scoring": "normalized_match",
  "description": "Сгенерировано + адверсариально верифицировано (3 линзы). Домен litigation.",
  "gold_source": "lawyer-authored skills репо + верификация норм",
  "needs_expert_review": true,
  "license": "CC-BY-4.0",
  "version": "0.2.0"
}
